{
  "$schema": "https://json-schema.org/draft/2020-12/schema",
  "title": "定期最新化の観測・変更・独立レビュー記録",
  "type": "object",
  "additionalProperties": false,
  "required": [
    "schema_version",
    "run_id",
    "base_sha",
    "writer_run_id",
    "started_at",
    "completed_at",
    "systems",
    "observations",
    "changes",
    "review"
  ],
  "properties": {
    "schema_version": {
      "const": 2
    },
    "run_id": {
      "type": "string",
      "pattern": "^[a-z0-9][a-z0-9-]{3,79}$"
    },
    "base_sha": {
      "type": "string",
      "pattern": "^[a-f0-9]{40}$"
    },
    "writer_run_id": {
      "$ref": "#/$defs/runIdentity"
    },
    "started_at": {
      "$ref": "#/$defs/timestamp"
    },
    "completed_at": {
      "$ref": "#/$defs/timestamp"
    },
    "systems": {
      "type": "array",
      "minItems": 1,
      "maxItems": 3,
      "uniqueItems": true,
      "items": {
        "type": "string",
        "pattern": "^[a-z0-9-]+$"
      }
    },
    "observations": {
      "type": "array",
      "minItems": 1,
      "maxItems": 100,
      "items": {
        "type": "object",
        "additionalProperties": false,
        "required": [
          "system_id",
          "status",
          "summary",
          "sources",
          "affected_docs"
        ],
        "properties": {
          "system_id": {
            "type": "string",
            "pattern": "^[a-z0-9-]+$"
          },
          "status": {
            "enum": [
              "changed",
              "unchanged",
              "unverifiable",
              "failed"
            ]
          },
          "summary": {
            "$ref": "#/$defs/summary"
          },
          "sources": {
            "type": "array",
            "maxItems": 30,
            "items": {
              "type": "object",
              "additionalProperties": false,
              "required": [
                "url",
                "accessed_at"
              ],
              "properties": {
                "url": {
                  "type": "string",
                  "minLength": 10,
                  "maxLength": 4096,
                  "pattern": "^https://"
                },
                "accessed_at": {
                  "$ref": "#/$defs/timestamp"
                },
                "published_at": {
                  "$ref": "#/$defs/date"
                },
                "effective_at": {
                  "$ref": "#/$defs/date"
                }
              }
            }
          },
          "affected_docs": {
            "type": "array",
            "uniqueItems": true,
            "items": {
              "type": "string",
              "pattern": "^docs/[0-9]{2}-[a-z0-9-]+/[a-z0-9-]+\\.md$"
            }
          }
        }
      }
    },
    "changes": {
      "type": "array",
      "minItems": 1,
      "maxItems": 40,
      "items": {
        "type": "object",
        "additionalProperties": false,
        "required": [
          "path",
          "kind",
          "observation_indices",
          "summary"
        ],
        "properties": {
          "path": {
            "type": "string",
            "minLength": 1,
            "maxLength": 240
          },
          "kind": {
            "enum": [
              "substantive",
              "reference-only",
              "supporting"
            ]
          },
          "observation_indices": {
            "type": "array",
            "minItems": 1,
            "uniqueItems": true,
            "items": {
              "type": "integer",
              "minimum": 0,
              "maximum": 99
            }
          },
          "summary": {
            "$ref": "#/$defs/summary"
          }
        }
      }
    },
    "review": {
      "type": "object",
      "additionalProperties": false,
      "required": [
        "verdict",
        "risk",
        "independent",
        "reviewer_run_id",
        "reviewed_at",
        "content_digest"
      ],
      "properties": {
        "verdict": {
          "enum": [
            "approved",
            "changes_requested"
          ]
        },
        "risk": {
          "enum": [
            "low",
            "requires-human"
          ]
        },
        "independent": {
          "const": true
        },
        "reviewer_run_id": {
          "$ref": "#/$defs/runIdentity"
        },
        "reviewed_at": {
          "$ref": "#/$defs/timestamp"
        },
        "content_digest": {
          "type": "string",
          "pattern": "^[a-f0-9]{64}$"
        }
      }
    },
    "coverage": {
      "type": "array",
      "maxItems": 3,
      "items": {
        "type": "object",
        "additionalProperties": false,
        "required": [
          "system_id",
          "scope",
          "status",
          "verified_on",
          "description"
        ],
        "properties": {
          "system_id": {
            "type": "string",
            "pattern": "^[a-z0-9-]+$"
          },
          "scope": {
            "const": "declared-system"
          },
          "status": {
            "const": "verified"
          },
          "verified_on": {
            "$ref": "#/$defs/date"
          },
          "description": {
            "$ref": "#/$defs/summary"
          }
        }
      }
    },
    "vendor_checks": {
      "type": "array",
      "maxItems": 3,
      "items": {
        "type": "object",
        "additionalProperties": false,
        "required": [
          "vendor",
          "release_notes",
          "deprecations",
          "pricing",
          "summary",
          "sources"
        ],
        "properties": {
          "vendor": {
            "enum": [
              "anthropic",
              "openai",
              "google"
            ]
          },
          "release_notes": {
            "enum": [
              "changed",
              "unchanged",
              "not_checked"
            ]
          },
          "deprecations": {
            "enum": [
              "changed",
              "unchanged",
              "not_checked"
            ]
          },
          "pricing": {
            "enum": [
              "changed",
              "unchanged",
              "not_checked"
            ]
          },
          "summary": {
            "$ref": "#/$defs/summary"
          },
          "sources": {
            "type": "array",
            "maxItems": 30,
            "items": {
              "type": "object",
              "additionalProperties": false,
              "required": [
                "url",
                "accessed_at"
              ],
              "properties": {
                "url": {
                  "type": "string",
                  "minLength": 10,
                  "maxLength": 4096,
                  "pattern": "^https://"
                },
                "accessed_at": {
                  "$ref": "#/$defs/timestamp"
                },
                "published_at": {
                  "$ref": "#/$defs/date"
                },
                "effective_at": {
                  "$ref": "#/$defs/date"
                }
              }
            }
          }
        }
      }
    }
  },
  "$defs": {
    "timestamp": {
      "type": "string",
      "pattern": "^\\d{4}-\\d{2}-\\d{2}T\\d{2}:\\d{2}:\\d{2}(?:\\.\\d{1,3})?Z$"
    },
    "date": {
      "type": "string",
      "pattern": "^\\d{4}-\\d{2}-\\d{2}$"
    },
    "runIdentity": {
      "type": "string",
      "minLength": 4,
      "maxLength": 160
    },
    "summary": {
      "type": "string",
      "minLength": 1,
      "maxLength": 5000
    }
  }
}
